batch_number,swipe_file_name,product_category,platform,ad_id,authority_used,copy_tone,cta_type,cta_urgency,duration,emotional_journey,format_type,hook_strength,hook_type,hook_verbatim,mechanism,notes,objection_handling,offer_mentioned,overall_score,pacing,problem_identified,product_type,social_proof_elements,standout_element,visual_style,weaknesses
01,AI UGC + Doctor Avatars — Beauty,Beauty / Skincare,Meta,GetHookdAI(55).mp4,"Dr. Khushal Gaigole, Cosmetologist","Educational, Clinical/Scientific, Conversational",Shop Now,No,84,Curiosity Gap → Problem Identification → Scientific Solution/Mechanism → Benefit Visualization (Glowing Skin) → Action,"Talking Head, Doctor Avatar, Product Demo, Text-on-screen",4.0,"Curiosity Gap, Question","""You must be wondering if you consume this tablet for consistently 2-3 months""","The supplement uses 600mg of L-Glutathione (a powerful antioxidant) combined with Vitamin C to enhance the brightening effect, plus Vitamin E and Hyaluronic Acid to hydrate and nourish the skin barrier.","The ad effectively leverages the ""Doctor Avatar"" format to build immediate trust and credibility for an ingestible beauty product. The use of a specific influencer/doctor discount code is a smart way to track the ad's direct conversion performance. However, the bold ""guaranteed results"" claim without visual proof might trigger ad compliance issues on stricter platforms like Meta or TikTok.","Addresses health/safety concerns by stating it has ""zero added sugar"" and is ""safe."" Also includes a medical disclaimer for pregnant or lactating women to consult a doctor before consumption.",Extra 10% discount using the code KHUSHAL10.,7.0,Medium,"Dark spots, pigmentation, and uneven skin tone.",Glutathione effervescent skin supplement tablets.,None,"The clear, structured breakdown of the ingredients (Glutathione, Vit C, Vit E, Hyaluronic Acid) and their specific functions, delivered by an authoritative figure, making the scientific claims easy to digest. The visual of the effervescent tablet dissolving also adds a satisfying, dynamic product demonstration.","Clean, professional, clinical, well-lit clinic environment.","The ad makes a strong claim of ""guaranteed results"" but fails to provide any visual proof, such as before-and-after photos or real user testimonials, to back it up."
01,AI UGC + Doctor Avatars — Beauty,Beauty / Skincare,Meta,GetHookdAI(56).mp4,"Founder of Moerie, built with scientists","Conversational, Empathetic, Urgent",Tap below,"Yes - The entire premise of the ad is built on scarcity: ""We overproduced this batch,"" ""Once it's gone, this price isn't coming back,"" and ""Tap below before it sells out.""",88,Objection (Price) → Excitement (Flash Sale/Lucky Day) → Empathy/Agitation (The pain of thinning hair and being ignored) → Education/Logic (Time-release absorption mechanism) → Hope/Validation (Social proof and UGC) → Urgency (Scarcity of the batch) → Action,"Talking Head, Voiceover + B-roll, Text-on-screen, Product Demo",4.5,Pattern Interrupt,"""I'd try Moerie, but it's too expensive for me. Well, it's your lucky day. I'm the founder of Moerie...""","Real time-release delivery. The ad claims that standard supplements flush out of the body in 60 minutes, resulting in ""expensive pee."" Moerie's mechanism feeds the exact nutrients (biotin, zinc, folate, B-complex) to hair follicles over an 8-hour period to ensure actual absorption.","The framing device of standing in a warehouse full of branded boxes perfectly visually supports the ""we overproduced a batch"" marketing angle. Calling out a specific, expensive competitor (Nutrafol at $90/month) is a bold move that effectively anchors Moerie as the smarter, more affordable alternative. The dynamic, word-by-word text overlays are well-executed for sound-off viewing.","Excellent objection handling throughout. Price: Addressed in the first 3 seconds. Efficacy: Addressed by explaining the time-release mechanism vs. standard pills. Dismissal: Validates women who are tired of being told it's ""just aging."" Authenticity: Warns that ""anywhere else is a knockoff,"" directing them to the official site.","A ""flash pricing"" deal due to an overproduced batch. No specific dollar amount or percentage off is stated, relying instead on the perceived value of the ""best deal we've ever run.""",8.5,Fast,"Hair loss and thinning in women, specifically targeting those over 35 experiencing a widening part, shrinking ponytail, and finding hair in the drain. It also addresses the emotional problem of being dismissed by doctors who say ""it's just stress or aging.""",Dietary supplement (hair growth capsules),"Claims that ""thousands of women have switched."" References customer DMs and testimonials (e.g., ""hairdresser noticed first,"" ""less hair in the drain""). Visually supported by numerous fast-paced UGC-style clips of women showing off their hair.","The visual metaphor for poor absorption. Showing a handful of pills being thrown in the trash and yellow liquid being poured into a toilet while saying ""you're not just making expensive pee"" is a highly memorable and visceral way to discredit competitors and elevate their own mechanism.","A hybrid approach. The main narrative is driven by a polished, well-lit ""founder"" in a clean warehouse setting (reinforcing the overstock narrative). This is interspersed with raw, authentic-looking UGC clips, clinical animations (time-release capsule), and visceral B-roll (hair in the drain, pouring yellow liquid into a toilet).","The ""founder"" appears to be an AI-generated avatar (likely HeyGen or similar). While the generation quality is high, the slight stiffness in facial expressions and lip-sync may trigger the ""uncanny valley"" effect for savvy viewers, potentially breaking the trust the ""founder"" persona is meant to build."
01,AI UGC + Doctor Avatars — Beauty,Beauty / Skincare,Meta,GetHookdAI(57).mp4,None,"Conversational, Educational","Follow for more tips, check the link",No,216,Curiosity -> Amusement -> Education -> Satisfaction,"Talking Head, Product Demo, Tutorial",5.0,Question,"""Ay coño. Miren, miren eso, miren. Ustedes ven como se ven todos los pelitos ahí.""","Using a collagen-infused spray to highlight facial hair, then a dermaplaning tool to remove it and dead skin, creating a smooth base.","The creator's highly relatable, humorous, and slightly sassy personality carries the video. The visual proof of the product working is undeniable and very satisfying to watch. The use of a user comment as the hook is a classic and effective UGC strategy.",Addresses price by joking about other expensive things in life; addresses trust by saying it's better to do it yourself than let others touch your face.,"None specific, just general cost savings vs salon",8.0,Fast,Facial peach fuzz preventing glowing skin,Dermaplaning system (spray and razor),"User comment asking for her skincare routine, personal testimony of using the brand for years.","The visual contrast of the white spray highlighting the dense peach fuzz, followed by the satisfying removal process.","Authentic UGC, extreme close-ups, casual setting",The video is quite long (over 3 minutes) and could lose viewers before the main CTA.
01,AI UGC + Doctor Avatars — Beauty,Beauty / Skincare,Meta,GetHookdAI(58).mp4,None,"Conversational, Empathetic",None,No,48,Problem (aging skin/perimenopause) → Search for solution → Discovery → Proof (tracking progress) → Satisfaction/Desire.,"Talking Head, Testimonial, Product Demo, Before/After",4.0,Problem Agitation,"""I have just turned 44. The perimenopause has decided to creep into my life.""",The products contain natural collagen-boosting ingredients to plump and firm the skin.,"The video effectively uses dynamic text overlays to keep the viewer engaged. The progression of time is a very strong visual storytelling device for skincare. The lighting changes slightly between shots, which adds to the authentic UGC feel but makes scientific before/after comparisons slightly difficult.","Skepticism is implicitly handled by showing a documented, multi-week progression of real results.",None,7.0,Medium,"Perimenopause skin issues including dark spots, red blotchy patches, dark circles, and fine lines.",Skincare duo (Serum and Facial Oil),"User testimonial, documented timeline of results (Day 1, Day 8, 2 weeks, 4 weeks)",The authentic week-by-week progression showing visible improvements on a real person's face builds strong credibility.,Raw/authentic UGC,"The ad completely lacks a Call to Action (CTA) at the end, leaving the viewer without clear next steps on where to buy or learn more."
01,AI UGC + Doctor Avatars — Beauty,Beauty / Skincare,Meta,GetHookdAI(59).mp4,"Cites a study from the Journal of Cosmetic Dermatology, showing a PubMed abstract on screen.","Conversational, Educational",Try it risk free,No,135,Problem → Education → Hope → Proof → Action,"Talking Head, Product Demo, Listicle, Testimonial",4.0,Curiosity Gap,"""I'm 53 and menopausal. Here are three things I wish I knew sooner.""","Instead of relying on animal-based collagen supplements, applying specific plant-based antioxidants directly to the skin boosts the body's natural ability to produce its own collagen.","The ad effectively uses a relatable creator who fits the target demographic perfectly. The script is well-structured, using a '3 things' listicle format to maintain engagement while educating the viewer before introducing the product. The inclusion of a mini vlog-style progression (Day 3, Day 9, Final Day) adds significant authenticity.",Addresses the ineffectiveness/grossness of oral collagen supplements and handles purchase hesitation with a strong money-back guarantee.,60-day money-back guarantee.,8.0,Medium,"Menopausal skin aging (loss of collagen, wrinkles, dryness, itchiness).",Pro-ageing facial serum and oil duo.,"Creator's own day-by-day video diary of results, Trustpilot rating page showing 4.5 stars and nearly 7k reviews.","The stark visual contrast between the unappealing industrial production of animal collagen supplements and the fresh, vibrant natural ingredients of the promoted topical product.",Raw/authentic UGC,"At over two minutes, the ad is quite long for typical social media placements and might suffer from viewer drop-off before the final call to action."
01,AI UGC + Doctor Avatars — Beauty,Beauty / Skincare,Meta,GetHookdAI(60).mp4,None,"Conversational, Empathetic, Educational",Click the link below,Yes - 20% off for the next 24 hours,267,Frustration (aging/pain) -> Discovery (collagen loss) -> Skepticism -> Success (feeling/looking better) -> Proof -> Action.,"AI UGC, Talking Head, Before/After, Testimonial",5.0,Curiosity Gap,"""I am turning 60 in a few days, so can I be completely honest with you?""","Rebuilding collagen from the inside out using a blend of Bovine and Marine collagen for different body parts, combined with Vitamin C to ensure actual absorption past the gut.","The script is very well-structured, blending beauty and wellness concerns to broaden the product's appeal. It effectively uses education (the Vitamin C absorption mechanism) to differentiate the product from competitors. The text overlays are simple but highlight key points well.","Addresses skepticism about ingestible collagen working for joints, explains why other products fail (lack of Vitamin C), and removes financial risk with a 90-day guarantee.",20% off for 24 hours and a 90-day results guarantee.,8.0,Medium,"Aging signs including painful joints, wrinkles, and thinning hair due to menopause.",Collagen supplement powder,"Personal testimonial, friend's recommendation, compliments from family and social media, before/after photos.","The initial hook claiming she is turning 60 is very strong because her appearance contradicts typical expectations, instantly hooking the viewer to find out her secret.","Raw/authentic, lifestyle","The video is quite long at over 4 minutes, which might lead to audience drop-off before the final call to action. The AI/filter effect on the face is slightly noticeable."
01,AI UGC + Doctor Avatars — Beauty,Beauty / Skincare,Meta,GetHookdAI(61).mp4,"Professional/Expert persona (implied, AI-generated)","Conversational, Urgent",Click the orange button to check availability,Yes - Emphasizes that the product keeps selling out and urges viewers to hurry before stock is gone.,152,Shock → Problem Agitation → Hope → Proof → Action,"AI UGC, Talking Head, Before/After, Text-on-screen",5.0,Pattern Interrupt,"""I'm gonna grab you by the pussy or the balls when I tell you this.""","Reishi mushroom extract helps the skin restore its own natural repair cycle, rebuilds the barrier, and boosts collagen production to counteract estrogen loss.","This ad relies heavily on a shock-value hook to stop the scroll. Once past the hook, it delivers a very solid direct response structure: identifying a specific problem (hormonal skin), introducing a unique mechanism (Reishi mushroom), providing social proof, and ending with a strong, urgency-driven offer.","Addresses ingredient quality concerns by emphasizing third-party testing, gentle processing, and lack of fillers compared to competitors.",3 products for the price of 1 (seasonal sale),8.0,Medium,"Hormonal skin decline, sagging, and dullness due to estrogen drop.",Mushroom barrier serum and repair cream,"Before/after photos, user counts (over 200,000 women), anecdotal client success stories","The highly unexpected and vulgar opening hook delivered by a sophisticated-looking, AI-generated older woman creates a massive pattern interrupt.","Clean, professional talking head with dynamic text overlays",The extreme vulgarity of the hook is highly risky and likely to get the ad banned on major ad platforms. The AI generation is also slightly noticeable.
01,AI UGC + Doctor Avatars — Beauty,Beauty / Skincare,Meta,GetHookdAI(62).mp4,"No specific medical or scientific authority (like a doctor or dermatologist) is featured. The ad relies on the relatable authority of ""everyday guys"" sharing their experiences.","Conversational, Empathetic, Educational","Click the link to try it now, GET YOURS NOW","Yes - The ad concludes with a large, on-screen 5-second countdown timer (5, 4, 3, 2, 1) to drive immediate action.",91,Frustration → Curiosity → Hope/Education → Trust → Action,"AI UGC, Talking Head, Voiceover + B-roll, Text-on-screen, Product Demo, Before/After, Testimonial",4.0,"Curiosity Gap, Problem Agitation","""I work out, I eat well, I dress well, I take care of myself. But I realized there was one thing I was missing that was affecting how I looked every single day.""","A ""Peptide and Collagen formula made specifically for men."" These peptides work at a deeper level than regular moisturizers to stimulate the skin to produce more collagen, thereby firming the skin back up.","The script structure is excellent, smoothly transitioning from the hook to the ""secret"" to the product reveal. The dynamic, word-by-word captions are highly effective for mobile viewing (sound off). The AI generation is quite good, but the mandatory disclosure is a double-edged sword for authenticity.","Relevance: Addresses the objection that skincare is just repurposed women's products by stating it was ""built from scratch for how men's skin ages."" Risk/Skepticism: Completely removes financial risk and the hassle of returns with the ""no questions asked,"" keep-the-bottle money-back guarantee. Effort: Highlights that it only takes ""one pump, two minutes"" once or twice a day.","A ""60-Day Money-Back Guarantee"" with the specific, high-value addition of ""Keep the bottle, no need to ship it back.""",8.5,Fast,"Men's skin showing signs of aging and fatigue, specifically focusing on the eye area (bags, lines, permanent tired look, wrinkles, crow's feet).",Anti-aging serum,"Visual Before/After comparisons, a bold claim of ""OVER 500,000 MEN ALREADY DOING THIS"", on-screen text reviews/testimonials from named users (e.g., ""Daniel K."", ""Michael L."") praising the product's anti-aging effects.","The incredibly strong, friction-free offer at the end: a 60-day money-back guarantee where the customer doesn't even have to return the physical product. This is a massive conversion driver.","Polished UGC (User-Generated Content). It features clean, bright bathroom settings and close-up, selfie-style shots that feel authentic but are well-lit and high-quality.","The video includes a persistent, albeit small, watermark stating ""This video contains AI-generated content."" While the AI avatars are high quality, savvy consumers who notice this disclaimer might feel a drop in trust regarding the authenticity of the ""real guys"" and their before/after results."
01,AI UGC + Doctor Avatars — Beauty,Beauty / Skincare,Meta,GetHookdAI(63).mp4,Endocrinologist with over 20 years of experience treating metabolic and weight-related conditions.,"Educational, Clinical/Scientific, Empathetic, Warning",Click the link below.,No,361,Curiosity/Alarm → Empathy/Validation → Education/Fear → Frustration → Hope/Clarity → Reassurance → Action,"AI UGC, Doctor Avatar, Talking Head, Text-on-screen",5.0,"Curiosity Gap, Warning/Alert, Authority Statement","""I grew up with 4 sisters All of them got on Ozempic What happened to their faces made me speak up""","The ad claims rapid fat burning releases years of stored toxins, heavy metals, and metabolic waste into the body, creating a ""firestorm of oxidative stress."" Free radicals then shred collagen from the inside out and choke mitochondria. The solution, Astaxanthin, is pitched as a unique antioxidant that embeds directly into cell membranes (crossing blood-brain and retinal barriers) to neutralize free radicals at the source, protecting mitochondria and the fibroblasts that produce collagen.","The script is a masterclass in targeted copywriting. It identifies a highly specific, high-intent niche (people experiencing GLP-1 side effects) and speaks directly to their exact pain points with a compelling narrative arc. However, the execution relies heavily on the viewer's willingness to listen to a 6-minute monologue. Adding visual aids to illustrate the ""oxidative stress"" and ""cell membrane embedding"" concepts would significantly elevate the ad's effectiveness.","Debunks collagen powders, creams/surgery/Botox, and other Astaxanthin brands (synthetic, low dosage, poor absorption).",90-day money-back guarantee.,8.0,Medium,"""Ozempic face"" (hollow cheeks, sunken eyes, jowls, turkey neck), rapid aging, loose/saggy skin, hair loss, severe exhaustion, and brain fog resulting from rapid weight loss via GLP-1 medications.",Supplement (Astaxanthin oil-based soft gel by the brand Clarity MD).,"Anecdotal mentions of his sisters, cousins, and patients seeing results. References ""clinical studies at 12 mg.""","The highly detailed, scientifically plausible explanation of *why* the problem occurs (toxin release causing oxidative stress). By clearly defining the root cause, it effectively invalidates all competing treatments (collagen, surgery) and positions their specific product as the only logical solution.",Clean/clinical,"The video is exceptionally long (6 minutes) and visually monotonous. Relying solely on a static talking head without any B-roll, scientific diagrams, or visual proof (before/afters) makes it difficult to maintain viewer retention. Additionally, the speaker appears to be an AI-generated avatar, which, if noticed by the viewer, could severely damage the established ""doctor"" trust and credibility."
01,AI UGC + Doctor Avatars — Beauty,Beauty / Skincare,Meta,GetHookdAI(64).mp4,None,"Conversational, Empathetic, Educational",Click below,No,129,Problem/Vulnerability → Frustration → Discovery/Hope → Education → Proof/Validation → Action,Voiceover + B-roll,5.0,Curiosity Gap,"""My hairdresser asked what I changed. I told her it was just my shampoo.""","Unlike traditional shampoos that only treat the hair strand, this product works at the scalp level to support circulation and keep follicles active, counteracting the effects of declining estrogen. It achieves this using a blend of Rosemary oil, Caffeine, and Copper Peptides.","The script structure is excellent, perfectly balancing an emotional, personal narrative with clear, easy-to-understand scientific explanations. The transition between relatable UGC footage and high-quality 3D animations effectively bridges the gap between empathy and clinical credibility. The text overlays are bold, well-timed, and highlight the core message effectively for viewers watching without sound.",Yes - The ad addresses skepticism head-on and acknowledges the frustration of past failed solutions.,None,8.5,Medium,"Hair thinning, widening parts, and texture changes specifically associated with perimenopause and menopause.",Hair care / Shampoo,"Hairdresser validation, grid of various women's faces","The framing device of the long-time hairdresser noticing a dramatic change and being shocked that it was ""just a shampoo.""","raw/authentic, lifestyle, polished, clinical","The ad lacks a strong, specific offer (such as a discount code, bundle deal, or money-back guarantee) at the end, which could potentially reduce immediate click-through and conversion rates despite the compelling story."
01,AI UGC + Doctor Avatars — Beauty,Beauty / Skincare,Meta,GetHookdAI(65).mp4,"AI-generated female ""doctor"" avatar wearing medical scrubs with ""MD"" embroidered","Educational, Urgent, Warning-oriented",Learn More / Click-through,No,62,Warning/Fear → Agitation → Hope → Proof → Action,"AI UGC, Doctor Avatar, Voiceover + B-roll, Text-on-screen, Split-screen",5.0,"Warning/Alert, Curiosity Gap","""This common skincare habit could be doubling your crepey skin!""","The ad uses a ""Root Cause"" framework, claiming traditional moisturizers are ineffective. It teases a ""DIY trick"" or ""wonderful remedy"" that reverses the issue in two weeks or less, without revealing the exact scientific mechanism.",Excellent text-on-screen strategy highlighting key emotional trigger words in red and using dynamic pop-ups. Picture-in-picture circle overlay early in the video is a great pattern interrupt.,Yes. Addresses skepticism of viewers who spent a fortune on ineffective creams by explaining they don't treat the root cause.,None,7.5,Fast,"Thin, aging, ""crepey"" skin on the body (neck, chest, arms, legs, back of hands)","Undisclosed (likely information product, supplement, or specialized skincare treatment)","Script states ""already helped thousands of lovely women""; names ""Lisa, Natalie, and Sandra"" with B-roll of smiling women","The visceral, highly specific B-roll of crepey skin being pinched and pulled, effectively visualizing the pain point.","Hybrid: relatable, raw, UGC-style B-roll with polished, clinical doctor avatar setup","The AI doctor avatar is deep in the ""uncanny valley"" with noticeably off lip-sync, stiff facial expressions, and unnatural blinking, damaging credibility."
01,AI UGC + Doctor Avatars — Beauty,Beauty / Skincare,Meta,GetHookdAI(66).mp4,None,Conversational,None present in the video itself.,No,7,Curiosity → Desire,"Text-on-screen, Testimonial",4.0,Curiosity Gap,"""I'm legit fan-girling over my eye serum. Where did my eye bags go?""","None mentioned; it simply credits an unnamed ""eye serum.""","This is an extremely minimalist piece of content. It features no spoken audio, relying entirely on the visual proof and a single text box. It is highly optimized for short-form platforms like TikTok or Instagram Reels, where native-looking, low-production content often performs best.",No,No,5.0,Slow,Eye bags / under-eye puffiness,Eye serum,Testimonial,"The extreme, unedited-looking close-up of the subject's skin, which visually validates the bold claim made in the text box.","Raw/authentic, extreme close-up, selfie-style","The video lacks a product name, brand mention, and Call to Action. It relies entirely on the platform's caption or surrounding ad copy to drive any actual conversion."
